name,start,title,review
janice,5.0 out of 5 stars,Well- rounded device,"Great option for those looking for an accurate fitness tracker. The combination of its durable and light built, sleep tracking and overall accuracy of fitness and health tracking make for an overall well-rounded device ."
SNEHASISH CHANDRA,3.0 out of 5 stars,The overall product is good,The media could not be loaded.  The overall product is good...but only flaw is that it automatically resets itself...battery backup is good.
LJ AmZic,2.0 out of 5 stars,Better options available,Display is not full screen as shown(cheap advertisement starts there). Not worth the discounted price too with built quality and function. Inaccurracy from steps to SpO2.Battery life and navigation is ok.
Nitin,4.0 out of 5 stars,Good product at this process point.,"Using it regularly from around 2 months now. Good product, seems accurate as well, haven't verified it with any calibration test. Only reducing 2 stars due to unavailability of watchfaces for this model. Also firmware is also not updating tried multiple times."
Shivanand ojha,5.0 out of 5 stars,Excellent smartwatch,"I liked everything in this device. This device works promptly but the app is little slow but ok for me . For this price range it’s the best smart watch I can say. It’s the best watch for the people who want basic application like call alerts, messages , workout , steps etc. look wise also it’s perfect.I really recommend people to buy this if they have this amount of budget…."
Saptarshi Paul Choudhury,5.0 out of 5 stars,Good for the price,For the price it's good tracks most of the thing only lacks spo2 and you can't select watch face from 3rd party apps that's a bummer for me if your okay with this
Arun Pappachan,4.0 out of 5 stars,Good Smartwatch,"I bought up this for 1699/bluetooth connectivity is gud. And its very light weight, good to use, but not full screen screen is only half as seen in image. Tracking activity is good, charging is good i getting 10 days. Not full black the sorround after the screen is grey colour"
Vikim gupta,1.0 out of 5 stars,Don’t buy,"Worst buy ever, would like to return and refund would be appreciated"
Ashish Singh Danu,1.0 out of 5 stars,Didn't even run a single day.,"Got the product in the morning, used in the evening for running.While running after 3km it stopped working, it was showing blinking lights in the back of the watch and screen wasn't showing anything jus Complete black."
Balaji.j,1.0 out of 5 stars,Very very  very worst . please don't order it,The media could not be loaded.  I order it 45 before but today not working this watch don't buy this product .very very bad quality.i really dispointment. Waste of money . particular Amazon site .don't buy a product this site
Amazon Customer,1.0 out of 5 stars,Worthless Watch!,"Don't buy this product, I am using this watch from last six month, feel like made a big mistake. Not a single activity tracking you can trust.Also, facing numerous issues like disconnection, device not found, lack phone notification etc.Think twice before purchase!!!"
Amazon Customer,1.0 out of 5 stars,Good watch but,Very excellent watch with many options. but the app doesnt support it gets hanged always. coudnt change the watch settings since it gets hanged always. mifit and amazefit is great when compares with the noisefit app
Arnab Deka,1.0 out of 5 stars,Not worth the price. Don't buy it!,The product is overall okay. But not worth the price. Don't buy it. It does not show the accurate heart beat. Just a waste of money. There is no return of this product that's why I'm using it otherwise I would have returned if there was a return option but there is only replacement and no return.
Ci habeeb,5.0 out of 5 stars,Awesome battery backup 30days more,After a long time I got a good watch. Its battery backup surprised me. I think it's great to not be able to charge even after 30 days. Anyone can buy without a doubt. It’s a good product
Ujjwal Srivastava,1.0 out of 5 stars,Ok ok product,"My device was only showing calls and msg notifications dispite the permission was given, no notification for WhatsApp and others.Now it is not showing call and msg as well.Can any one give solution. How can I claim warranty."
VIJAY DALVI,1.0 out of 5 stars,Pathetic Product,"Worst product ever , Thought the product was good when you really experience it you know its really not worth it. The watch has issues connecting via Bluetooth with mobile. Keeps disconnecting and switching off on its own every time have to install and reinstall the app over and over againThe product quality is really bad and not up to standard."
shubhada agarwal,3.0 out of 5 stars,Dont buy any product from this company,Completely chinese 3rd class quality made products. It will hamd sometimes in your android or ios devices. Support team is useless and do not answer queries. There is no or very limited service centers too.
Raghav Agrawal,1.0 out of 5 stars,One star is too much,Not one thing is accurate with this. Complete waste of money. Garbage product. Touch screen is not quite responsive. And kudos to Amazon for not taking the returns.Money drained down the gutter.
sudhindharan,5.0 out of 5 stars,Quality Product,"A very effecient smart watch,that enables you to track your calorie burn,get through your day tracking the sports activities and much more.....a very good product."
Shikhar,1.0 out of 5 stars,Warning : Don't buy.,The product is like avg. The features they are giving in this high price isn't worth.The company says 10 days of battery life but it would only last 5 or 6 days. I personally would recommend to look for other options before buying this. U can get much better watch in this price .Warning : Don't buy
Pascal D.,1.0 out of 5 stars,The Watch is not charging.,"Registered a complaint (#497286) online and have written a mail. The service executive option on toll free number / service centre plays an automated message as "" all our executives are busy please hold the line or else leave a audio voice message and we will get back to you.A product brought is now lying on desk without any usage.Absloutely pathetic."
Rao Aditya,1.0 out of 5 stars,Don't buy,After pair many times don't show incomeing call. What's up message etc.Guys I Request to all that please don't buy this.
Gopi,4.0 out of 5 stars,..quality is good..software is excellent,Value for money Basic watch. Has all functions..value for money..but if you can afford go for 10000rs plus MI watch..quality is good..software is excellent
Sabisha K Sathyamoorthy,1.0 out of 5 stars,Below average performance for this price,Battery performance is not good. It finish up within 3 days. Connectivity with app also is very poor. Always having issues with connectivity
Mano,1.0 out of 5 stars,very very waste product,"i have purchased noise colourfit pluse royal blue model at last month , even after one month it was not working properly , display blind , 1 year warranty also unable to claim, totally waste of money, customer support also not responding, 2 time raise the complaint but no one rectified my complaint. very waste brand service"
Amazon Customer,1.0 out of 5 stars,"Very bad product, with bad service","Very bad product. Stopped working within 2 months. Complaint management is even worst.they don’t have any assistance system, I lodged a complaint ,that they didn’t resolve and closed the complaint on their own, stating issue has been resolved. How unprofessional."
maveric@69,1.0 out of 5 stars,Not so great,Not satisfied.After 20 days software related issues crop up. Sports activity page is gone. Want to return but now cant due to time gone
Siraz,2.0 out of 5 stars,Move to wake is very slow...,You have to move your hand to so hard to wake the screen to see time this watch does not worth 2k... I use noise products from beginning of this company but this product disappoined me.
Ritwick Choudhury,4.0 out of 5 stars,Good for basic fitness tracking and all,"The product is good. Comfortable to wear all the time. Battery life is really good, with my light use, it is running upto 15 days with full charge. All basic features are good. The only problem I am facing is with the Noisefit app. The display in the app is so bad that I can't even scroll sideways/updown to set alarm for example. The app really needs massive upgrade."
Priyanka Amrute,1.0 out of 5 stars,Do not buy this watch,"Please don't buy this watch by looks, this watch doesn't work properly at all even the app is also worst, it only shows one day's activities, next day everything will come to zero, activities doesn't add to weekly activity 😓 even after replacement the problem doesn't solve"
Alinda Fernandes,1.0 out of 5 stars,Bluetooth,The bluetooth takes forever to get connectedI really had to reset the whole watch to connect it atleast 5 timesI lost all my data till thenEven after getting connected it gets disconnected in sometimeAnd then doesn't get connected
Amazon Customer,1.0 out of 5 stars,नोटीफीकेशन डीसक्नेक्ट ऑल टाईम,नोटीफीकेशन फीचर काम नही करता एक बार नोटीफीकेशन क्लीयर करने के बाद साथ ही बार बार मोबाईल से डीसक्नेक्ट हो जाती थी इस लिए वापस भेज रहा हू😊फिर जो घडी आई वह युज की हुई है जिसमे डीसप्ले कव्हर ओर केबल कवर नहीं साथ ही बेल्ट बहोत पुराने हैमॅसेज भी इन्कूड आया फोटो देखो
Santosh P,5.0 out of 5 stars,It's simply awesome product.,"All features seems to be good,This is 3rd one from Noise in my family,working very well so far,had issues with data syncing,Hope will be solved shortly"
Amazon Customer,4.0 out of 5 stars,Good Product,"Likes>Good Looking>Steps counter is active ,I use only for this>wallpaper is good>Battery is goodDislikes>It needs internet to get connect>Sometimes app doesnt get updated with latest info"
Sun,3.0 out of 5 stars,Number of watch faces are less and are not updated.  It's strap has also broken within 1 year,Number of watch faces are less and are not updated. It's strap has also broken within 1 year
Kindle Customer,1.0 out of 5 stars,Bad product,It's not working. Today I got this Watch and after all things It's get started but when I unapir this from one phone and logged out then It's not starting. I'm trying to connect this with other phone but it's not working. I'm so worried I have paid 2000 for this and it not worthing.And one more question is this water resistant?
yoganand,4.0 out of 5 stars,Have some problems but still worth the price,"Sleep tracking is not working at all. And the android app for the watch is crashing as soon as I open(not always but 4 out of 10 times) and the app also have a lot of bugs, hoping the people fix them with some updates soon.But other than that the watch is worth for money."
Bablu,2.0 out of 5 stars,Waste of money,I had mistake to buy this product. It's totally waste of money. Strap quality is totally worth and i thought it would be better rather then better my mi watch strap. Ther was some scratch over the watch screen . As i checked on official website so it's not met with the original watch it's duplicate watch.
Rakesh Kumar,2.0 out of 5 stars,"Strap is not Skin Friendly, Caused my wrist allergy.","No doubt the smartwatch is good in features and has a responsive touch display, but the strap is not skin-friendly. It caused my wrist some kind of itching/allergy just after 2nd day. It was a horrible experience for me. I don't know what the strap material is but it is not 100% safe to skin."
Roopashree M,1.0 out of 5 stars,Lots of sync issues - watch to app,"The phone is ok, but the noise app is pathetic.It takes a life time to get the phone sync your workouts with the app.The challenges data, sleep data does not sync at all..The app requires serious updates to help us use it better"
harish sain,1.0 out of 5 stars,"Bad produsct, problem after 15 days of use","Do not buy this product, after 15 days issue with the watch, and very bad support from Noise, still not resolved. Waste of money and time.Amazon pls do sometjing from your end if you can."
Ankur,3.0 out of 5 stars,Ok Ok 👍👎,"Pros: looks great (grey color), feels light, smooth transition in screen, simple task tracking, good visibility, battery is just awesome, connection stays strongCons: plastic does not make it feel premium, 2/10 time screen will not respond (swipe/tap twice), call can be cancelled but cannot attend, seems to have inaccurate step counts (I am not a 100% on that since I walk but pretty sure not so much as the watch shows), kinda costly when it has small yet considerable problem when compared to other brands"
Revathi,3.0 out of 5 stars,Medicore smartwatch,"The product is a bit laggy. Not what I expected, I gets disconnected often and doesn't pair with app immediately. Sometime the app has difficulty in connecting with watch.Display is clumsy when navigating from one to another screen.Raised a complaint with noise and got only another replacement 🙃🙄. But no answer for device responsiveness.Lift up display has a good 3seconds delay. Not acceptable for a provide like noise.Overall the phone is better not good or worthy for this price."
Ankeeta,4.0 out of 5 stars,Good product.,I am writing this after using for almost 2 months. Overall product is good but battery life is less than 10 days. Near about 5 days.1. Maximum 10 notification get display.2. Sports mode sometims stop working.3. Bluetooth proximity to search phone is not great. Rest all looks great
Raj Patel,2.0 out of 5 stars,Review after use,"I'm writing this review after use of product. At the price of 2000, it having a decent perfomance. But i have problem with application. After app update, call notification stop working. When i install old version of same app it works normally."
Jitendra S.,1.0 out of 5 stars,Fraud & Duplicate product delivered,"FRAUD product delivered through Amazon Courier guy. Today @approx 9.30am, I got this duplicate smart watch (dummy piece) without charging cable. I paid for Noise Pro2 bt got a this stuff. I am already using one Noise Pro2 & know much about the actual watch."
SARATH CHANDRA BABU,5.0 out of 5 stars,"Value for money, very useful while driving and all","Mobile application is very slow. And I am not getting much watch faces. Only limited watch face is available in the application. Display is good one 👍. Touch screen also 👌. But the application is worst one. But I loved the watch. And the main thing in that getting scratches, but there no screen protector for this noise, I am not satisfied in that. Atleast company can provide a single one also screen protector"
Jenil Vagadiya ,5.0 out of 5 stars,Worth it,"I have been using this watch since a month. Here are my observationsBattery is lasting 15 days with heart monitoring onSleep monitoring is near to accurateNotifications are not coming sometimes but if you restart your phone then problem gets solved.In one line , this is the best watch to buy given the price limit."
Piyush Kumar,5.0 out of 5 stars,Buget friendly watch,Color fit 2 pro is a buget segment touch screen watch. The features in this watch such as sports mode and breathe mode is quite fasinating.For day to day purpose I generally use this watch and battery backup is upto 10 days and it charges 30% to 100% in less than one hour if you will use 2 ampere adapter for charging which you will commonly get in every phone of buget pocket friendly.
Chandra Shekhar,4.0 out of 5 stars,Good buy in Budget,"Nice features, looks great in hand.I have 2 of these in Black colorNice display, though sometimes the swipe had to be hard to workUnder this range gives a good satisfaction and accurate result."
Bhuvaneeth Gowda  K.A,1.0 out of 5 stars,Not worth for the price,"Really felt disappointed with the product, was very excited with the features but once received it doesn't even suit for the title of smart watch ..... way too much pricing for this not even worth it......"
NAWANG PHUNTSOG,1.0 out of 5 stars,.,"As I saw it first from Amazon, I thought it is good product and especially display of the product looks big. But later, it was deliver to me it's not worth at all.. but the real problem is that we can't returned it!! So, better think you go for it! I give 2 out of 10."
Anu Lal,3.0 out of 5 stars,Ok within this prize range.,"Ok within this prize range. I brought Rs. 2499 from Amazon India. Looks premium, light weight, good fit on hand. I don't see much watch faces in the app.Only one thing that I am disappointed from this watch is, there is no password protected for this watch. Even 2000 range Mi band 4 having this facility."
George,1.0 out of 5 stars,No display after 15days. Don't waste money.,No display after 15days. Each time we have to press the side button.
Kiran Alangar,2.0 out of 5 stars,"Poor product, do not buy","This watch doesn't track sleep right. There is no distance tracking for Cycling. Distance tracking for walking is not accurate. Huge difference between other tracker and this. Worthless product, do not buy"
Manoj,1.0 out of 5 stars,Bad:-Automatically data erased and sync problem,"BadUnsatisfied with the purchase. stop syncing with mobile after . Even after several times retrying to pair the device on mobile,it meane Bluthooth power issue. Many time all data erased automatically .."
Kiran,5.0 out of 5 stars,Worthy product. Buy it.,"It's a good product. Especially the battery backup so good. Am getting one week battery backup.And Watch connect with App and giving excellent performance. Now I can get notifications like calls,sms,and mail. It's a worthy product with this price. Am using this product more than 5 moths and writing this review. Touch screen also fabulous 🤩. Fall in love with this product. Thanks noise."
Anjnesh,1.0 out of 5 stars,Isseu in this watch,Everything is good when but after December 5th it was like when I will do 3000 steps it will restart to 0 steps and today at morning my watch was like disconnected I did not do enething but for the app it was connected pls do something I don't want this watch pls do soming thing
Tanmoy Bhowmik,1.0 out of 5 stars,Most 3rd class product,I have used noise fitness watch many years back that product is still working. watch may be good but app is pathetic. Do not buy noise fitness watch and the worst part is that if you like to return the product you have to send the product with your own cost.
Varun khanna,1.0 out of 5 stars,Pathetic... Buy if u want to high your BP.👎👎,Worse product I have ever purchase in my whole life. This watch show heart rate 180 bpm. Pathetic service provide when I have complaint against the issue they want to resolve their defect by mail only n without resolving the issue they closed my complain. Genuinely saying plz never ever buy this brand product.
SUPRATIM MITRA,2.0 out of 5 stars,Not value for money,"The watch does not function properly after few months, some app starts automatically and then stops. Touchscreen not working properly. Overall buying this watch is not worthy"
Husnakhan,1.0 out of 5 stars,Waste crap,Pls dont buy dis crap its a complete waste product waste of 4k .its doesnot connect to ur phone . always derz a Bluetooth connectivity problm .
Mohammed Usama,1.0 out of 5 stars,Disgrace in the name of Smartwatch.,I have purchased this product with so much expectations and enthusiasm but it disappointed me in a very good manner. I would suggest please go for any other brand rather wasting money in this. Amazefit is far more better option than this.
Ashok,1.0 out of 5 stars,Worst product. Money wasted.,"I stoped using this product. First of all, the noise app is worst app. I used it for my cycling, distance calculation is wrong. Main purpose of me buying the watch is dead.Only plus is the look. Rest is waste."
Rakesh Obilereddy ,2.0 out of 5 stars,Specifications,Does not have Full screen covered with black screen screen size is not as shown in image.Options are good for the price screen size should beIt us very bad
PravinMS,3.0 out of 5 stars,Decent product but it's still Chinese,"Good product in decent pricing, the product is good and helping us to track basic activities, however activities are only synced with noise app and can't be sync with starva , hope this gets fixed , post 5 days of use the battery is still 50% available ,hope to get 10 days backup."
R.BABU,1.0 out of 5 stars,Worst watch,"Not working properly, bluetooth connectivity is disconnected from device automatically, every time iam restarting both watch, mobile...worst product..."
Amazon Customer,1.0 out of 5 stars,Please don't buy this product. poor service.,Battery issue.have purchased this product 2 mth before and post 1 month have faced battey issue. have submitted the watch to customer care immediately but neither got any response nor replacement.
Naveen,2.0 out of 5 stars,Not worth,"This product have most simply (4) options no worth for this price, notification and call notification are very slow some times not working,, I try to return and refund but it's show there are no option only replacement,,Disappointed..."
VAIBHAV JAMOD,1.0 out of 5 stars,Dont buy,In between one month watch has stopped working.and customer care service is not replying for anything.i want to replace it or return it. I want to complaint but customer care facility is also worst.please fix this problem asap.
joshuasomasundaram,2.0 out of 5 stars,Good product but thr r some issues...,It's automatically unpaired every single day... And turned off
Sneha,1.0 out of 5 stars,Calorie burn showing 0,My watch is not showing calories burn which normal steps does burn some it's only 0 it's very difficult to reach out the customer service for the same and I am literally exhausted finding the solution for this for more than 48 hours now
Navendu Krishnan,4.0 out of 5 stars,Made in china,Product is good. But regretting it's a china made. Won't buy again
Sonia,1.0 out of 5 stars,Not satisfied,"The app keeps crashing, steps are not calculated...sometimes it captures data sometimes not...whatsapp notification though set to on is not displaying..."
Aashish kumar,5.0 out of 5 stars,Best in segment😎🤟💯⭐🎁🎀,Good option if u can't afford apple Watch. Looks exactly same & good on hand⭐💯🤟😎🎀
RAKSHIT KATHAWATE,5.0 out of 5 stars,Good buy for 4k,Battery backup and screen is really good. It has amazing watch faces and sleep tracking too. The heart rate monitoring with workouts is one of the features I looked up to. Good buy in good range
Dr Adil Aziz,1.0 out of 5 stars,Not connecting,"I really don't know how to rate this productI have recently bought this watch and I am facing lot of trouble .Got connected with phone first buf after updating the noise app watch is not getting connected..For me at present its just a waste product , touch is not soft as expected ..I am repenting why did I buy this product"
Amazon Customer,3.0 out of 5 stars,not highly accurate and bug free. meets expectations,Likes:good looks and few good features.Dislikes:Alarms disappear from smart watch.Noise app compulsorily takes location permission when opened.Accuracy of sleep/distance less as compared to other smart watches from mi.
rajeev b.,1.0 out of 5 stars,DONT BUY THIS,"after active use of hardly an hour , ist stop , and not working , DONT BUY THIS PRODUCT,looking for service center , will update further progress"
Manjinder singh,1.0 out of 5 stars,Opened box received,"Ihave purchased two pieces, this product is awesome but it is already opened piece and its having problem of connection with mobile app.This is only single defective piece I have received.Other piece was received with original packing and working fine."
Manas ,1.0 out of 5 stars,"Does not work, do not buy","The Bluetooth in the watch just does not work and never pairs with the phone. It’s a useless piece of junk, do not buy. Bought it for my mom as a gift and it just does not work. Took us sometime to figure that the actual issue was with the Bluetooth in watch itself and by then the return window was closed. Now I am stuck with a watch that does not work."
Shubham singh,1.0 out of 5 stars,Worst experience with this smart watch. Not worth of a single penny.,"The biggest problem with this smart watch is, it's data doesn't synch with the app. And everytime I trying refreshing it is still showing the data of past 10 days. I tried every possible ways available on internet to resole this issue, but this watch disappointed me. Never buy this product. It's a waste of money."
Mahi Kavitha,1.0 out of 5 stars,Worst product,I'm not yet satisfied with this product it's not as expected and its not the colour as shown in the picture just for colour you people are charging alot and also why you people make fake advertisements about the product features
Garima shukla,1.0 out of 5 stars,"Money waste, useless watch","Music section shows that it is connected to phone music player bt I can't operated my music player with this watch, it got connected and disconnected on its own, also the workout session stops automatically.total money waste"
Pratibha S.,5.0 out of 5 stars,The best watch in budget,I liked the product because it has a lot many features within the budget it was my first time buying a noise product and I did not expect such a great experience from noise moreover I also got a feedback call which ensures customer reviews I look forward to buy a noise product again. Even the app works better than some smartwatches app out there in this range. I hope this review helps many people.
