name,start,title,review
Captain Retail,5.0 out of 5 stars,"4.5 ⭐Awesome design, good specs and features. MiBand crusher.","The media could not be loaded.  Most smartwatches and smartband offer more or less of similar functionalities except for the ones where we can take calls on the watch itself. I wanted to get an Apple Watch for my wife as I was impressed by the design but fortunately I found this Noise ColorFit Pro 2 which looks very similar and premium like the Apple watch. Bought this one for Rs.2999.----------------------📦 IN THE BOX----------------------፨ The smart watch module with screen protector applied፨ 22mm wide TPU strap፨ Charging cable፨ Instruction Manual and Warranty Registration card--------------------⌚ FEATURES--------------------፨ 1.3 inch 240x240 capacitive display፨ Curved glass with anti-fingerprint coating,፨ IP68 Full dustproof and waterproof፨ 210 mah battery - 7 to 10 days usage, 45 days standby፨ Bluetooth 5.0 BLE፨ 24/7 heart Rate sensor, sedentary alarm, breathe feature, and usual health and sleep monitoring.፨ App, message, social media and call notifications.፨ Music control፨ Menstrual cycle tracking፨ 9 sports mode - Walk, Yoga, Spin, Run, Climb, Workout, Bike, Hike, Treadmill.---------------------🗓️ MY USAGE---------------------፨ At just 35g weight and 22mm TPU band makes this band the very comfortable to wear. Also the strap is skin friendly and I didn’t get allergy with sweat on this band.፨ The straps is easy to swap and replace if required and uses the spring pin type.፨ The charging is a magnetic ping type and there is no need to remove straps or do anything. I felt this type of charging the easiest of all.፨ The looks is very premium, though is made up of polycarbonate, the grey and black colors, the curved display on the sides and the size make it look like an Apple Watch.፨ There are only 5 of watch faces and some of them are like the Apple watch face design. As of now the watch faces are limited and customization is limited, I hope customizations will be made available.፨ The display is beautiful and under direct sunlight I found the watch display visible, though not the best visibility but to a certain extent.፨ There is 1 button the side which looks like the watch crown and it acts as the function button and return button. I found it easy to navigate using the touch display and using this button.፨ The IP68 certification means now I I don't have to worry about protection from water even more than 1m depth (IP_8) and also no need to worry about dirt (IP6_).፨ Health, fitness and sleep tracking is very accurate in my opinion, and surprisingly the NoiseFit sport app is also good. The breathe is just to take a break and just asks us to take a deep breathe. I found using a continuous heart rate sensor get the battery under 7 days and when this feature is turned off, it takes to almost 10 days.፨ The sleep, heart rate and health tracking are pretty accurate in my opinion. Most of the features available in smart bands and basic smart watches were available.፨ I can now read messages and notification from the band easily. From the app I was able to turn off and on what notifications need to be shown on the watch and notifications can be enabled for vibrations.፨ There are some quick access shortcuts from the watch like find my phone, turn off/on continuous heart rate monitoring, Do not Disturb, wrist. The female health care feature of menstrual cycle and ovulations cycle is a nice add in my opinion.-------------------------💖 WHAT I LIKED-------------------------◾ The premium design and great display. Much better than other smartwatches and bands in this category in my opinion.◾ Battery life of 7 to 10 days.◾ IPX68 dust and waterproof.◾ Pretty accurate fitness, health and sleep monitoring◾ Better control & display of calls, messages and music from the band-------------------------------------------------♻️ WHAT I FELT CAN BE IMPROVED-------------------------------------------------◾ More exercise or activities could have been included like Badminton etc.◾ Only 5 watch faces available but heard there will be more added this year.-------------------🍱 OVERALL-------------------The MiBand 4 is definitely feature rich and Noise ColorFit Pro 2 has similar or a bit more features, I found this one much better in areas like build, design, charging. I don't have a Honor Band so I can't compare but at this price category in my perspective this band is the best. 🥇"
Gaurav,1.0 out of 5 stars,DO NOT BUY THIS PRODUCT,"Pathetic quality product, not even worth 1000 rupees. Its highly overpriced & is not as advertised. The heart rate does not work, its very slow & the touch does not even respond most of the time.Do not buy this product, its a waste of money!"
Ganesh Moily,2.0 out of 5 stars,Issue in smartwatch,I am not getting call notification in smart watch
Mahir Dalwale,1.0 out of 5 stars,Looks doesn't matter.. Completely Worthless!!,"Apart from showing accurate time & much healthy battery & looks like Apple Watch, this Smart (Fitness) watch do nothing as the company represents it.Don't know, how can people have wrote positive about this.It was the only reviews basis what I've bought this & find useless after the item received.I guess, it was their first Fitness watch & that's why they liked this.Trust me, please go for Honor, Huawei, Samsung bands.They actually shows you the fact-based info about your fitness. I've Honor Band 5 & I just loved it still.Afterall, brand is brand & that's the only reason their products are on higher side in terms of price."
Saurabh S.,1.0 out of 5 stars,worthless product.,this product does not support with one plus phones and this is worthless product. please dont buy it.
Shashank,4.0 out of 5 stars,"Oh yes,love it👇","The media could not be loaded.  Just received the watch,premium quality,looks good, touch is sometym laggy, will report soon after usage about accuracy control and performance."
Sneha K,1.0 out of 5 stars,Don't buy this product!!,"Don't buy this product!!I received this product on 23rd December and used it for 4 days down, the product automatically gets disconnected and they you will have to uninstall the Noise app which is essential to use this watch then reinstall, after reinstalling it doesn't allow you to connect to the smart watch this happens continuously, i tried turning off the watch and doing the entire process again but all in vain.... Absolute dissatisfaction 🥺🥺😬😬"
sonu kumar,1.0 out of 5 stars,Bluetooth coverage is low..max 1 to 2 mtrs,Bluetooth coverage is 1 to 2 Mtrs max. Technically This will not solve ur smart watch dream. Don't purchase or u will regret..I had ordered for replacement also and same problem found in other product also..this means it's s manufacturing problem..2nd issue very delay in process3rd issue it's having touch than also u have to lift ur arms to see the watch..one tap option not given.4th issue vibrator is not so strong like Mi Band.request to go for other watch not Noise clorfit pro 2..
A P.,4.0 out of 5 stars,Read it! before buying,"The product is good for the price it is being sold. Accuracy is 3.5/5, look wise 5/5, battery life 4/5, screen response 3/5 but the main problem is with the application. Whenever the watch is out of Bluetooth range and comes back again in range of mobile it does not get automatically paired with mobile. every time you have to reinstall the application from the play store and again pair it. because of this all the data is lost and count start from ""zero"".i will not recommend this watch because of the application problem and makers of app also don't bother about fixing the issue.Go for mi smartband or any other band but just don't go for this"
Ronnie,4.0 out of 5 stars,Value for money,"After using for 20 days, i am here to write a review. This product is well packed and user manual is good. You cant connect with your smartphone directly with bluetooth. You need to download noisefit app for that and need to connect your watch. Connectivity is good. Fraction of seconds delay on notification. Display is good, feel is good. Looks is very good. SNS, like whats app, msg, facebook and other app notification you can see only. You can see the first line of each notification, but cant enter into the msg. To read the msg you need to use your phone(unless the msg is one liner).Heart rate monitor is closely correct. Step count is good. Sports mode is great. Real count of a cumulative of 3 steps. Alarm works well. Truly water proof(follow the IP68 standard). Dont use in salt water, it can damage.My usage is very high and still i get 4 days battery back up. Its pretty good.According to the cost of the product, you cant expect more than that. Its recommended to use this product."
arpit,1.0 out of 5 stars,Not even worth 500 rupees i beg not to buy,This is the worst product ever purchased. But thanks to amazon they are refunding me and they assured me that i will get my 3499 rupees back. This watch and the fitness app never connects and is so useless this is just a display thing that you are wearing a smart watch. I guess a 999 watch on amazon is more worthy than this. Never ever buy my friends. This is personal 5 6 day experience and i have attached it to my oneplus 7 pro. My vivo iphone. Oppo and many more i have attached a picture of the phones so you don't have doubt that something must be wrong with my phone and ya the rating of their fitness app is just 2. Never never buy i seriously beg if you don't want to waste hard earned money
Hemanta Rai,1.0 out of 5 stars,Disconnects Everytime,"Is 3k the price for everyday headache?I was really to have found a great product for a great price but just after two days I see why this might have been sold at this pricing. The watch keeps disconnecting from my phone and reconnecting steps online includes reinstalling the app, unbinding the device followed by ten other steps. The device has disconnected two days in a row and I have been breaking my head to reconnect it. While it is a great price it definitely isn't worth throwing away 3k at something that doesn't work."
manikandan,1.0 out of 5 stars,"Don't buy, horrible","Very worst product,. Recommend not to buy. Lots of glitches with this watch. Never connects sometimes, never vibrates on calls, never play music etc.. it works on its own way. Fooled by the positive reviews. Requested for the replacement"
Biswa,4.0 out of 5 stars,Smart choice over expensive smart watch,"Background: I have recently purchased an iPhone XR. I really need a smart watch which can track my daily activity, give me a stylish look and provide me various notifications. As usual my first thought was about apple watch.Why I preferred noise colorfit pro 2?Apple watch is very nice, which is a real smart watch. But problem is poor battery life.Do you really think of charging ur apple watch daily?In today’s life already I hv wireless earpods, loud speaker and smartphone which need to be charged daily. Really I don’t want to add one more thing to the list.Do you really need a smart watch to answer calls or reply messages when ur phn is in ur pocket or near by (bcoz if phn is not nearby then these features will not work)? If yes then believe me u r too lazy 🤗.Pros of colorfit pro 2: stylish look, working flawlessly with my iPhone. I can receive all notifications, read messages, control music (working nicely with gaana app, even if gaana app is not open, by clicking play button songs can be played). The activity tracker is also working fine. Good battery life.Cons: Only 5 watch faces (request to noise to update number of watch faces which ll make this watch awesome)Under bright sunshine, screen is hardly visible (the only thing with respect to which amazfit bip lite is the winner)Verdict: U can definitely try this watch though it is really not a smartwatch. In India, smartwatch technology is at nascent stage. So don’t expect much as compared to smartphones. Presently Smartwatch technology in India is like smartphone technology that was 5years ago. So better wait sometimes to use this smart technology at affordable price and let the rich people to enjoy the things for now😀"
Ritesh,1.0 out of 5 stars,No notification,Plz don't buy this watch it's not smart watch it's only smart band .. no call massage notification show in this watch very bad experience with noise pulse watch
Bhavin parmar,1.0 out of 5 stars,MADE ME FOOOL,"dont purchase its totally dumb watch i have ever seen,touch is not working some time ,some time call notification is still dhowing even after call is picked up by phone,message notification is inaccurate,no option for add more dialsand no update there is only 5 dials inbuilt in it activity is also not working good.totally waste of money purchase some other thing please dont purchase this because there is no option for refund even"
Biswamanohar Singh,5.0 out of 5 stars,I'm very happy for this product. I get maximum features in this price rate.,
Rajesh Sharma,1.0 out of 5 stars,Don't by before you read this,Third classs product once get connected and if you restart or get disconnected by mistakly if will never get connect automatically we have to uninstall the appp and reinstall the appp and than we have to bind the watch again again i m doing this process from 4 days i have given complaint via email jo rply yet dont by this product please money waste
Ashok,5.0 out of 5 stars,Lovable product noise company,"Thanks to noise color pro2 smart watch really excellent product,and thanks to amazon speed delivery"
Buyer from Karnataka,1.0 out of 5 stars,Display image is misleading,The screen size of the actual product and what is been displayed in the product description are misleading.
shajimon I J,1.0 out of 5 stars,Don't recommend..Don't be deceited by mere advertisement gimmick,When we try to count steps it gives a very inaccurate reading. Battery life is good after hardly a days use. Not looking great as far as value for money is concerned. The rating is done on the basis of my current experience. The charger or the charging port is looking inactive now...Need to get expert advice in this regard. I sent it to the manufacturer and got it back yesterday.. but I received a defective strap.but when I approached them for its replacement they responded negatively. Their service is very poor.
Patil,1.0 out of 5 stars,You can't request for replacement - very bad customer service,"Had issues with notification and connectivity from day 1 . Customer service is worst, You can't ask for replace you cannot request for replacement from Amazon you have to call Gonoise and raise a complaint they called after 3 days asked to check for few days and they closed the ticket without resolving the issue , I raised one more ticket they responded in 7 days and told they will not replace the device they will will take the device and repair it. Which will take 2 weeks as per the ""Company Policy"" ."
Abhishek R.,1.0 out of 5 stars,Made in China,"I purchased Noise product as i thought it would be made in India, but sadly its also made in China.. All products of Noise are made in China."
Private,1.0 out of 5 stars,"Warning Stay away, Worst product ever","Worst product and no suppert whatsoever.I ordered to gift my wife hence lost the 7 days return window.Opened it on day 10, from day 1 the Bluetooth connectivity had problems, and after a few days the touch stopped working.Since I purchased, initially, I actually referred this to a colleague as well and he had got it replaced twice, still it was faulty.Now I have raised a complaint since 2nd Feb, there has been no response or follow up till today, already 12 days have passed.Kindly stay away from this crap, if you want peace of mind."
Anoop,5.0 out of 5 stars,"Watch is amazing,worth it","I am using this watch since 4 months. I am amazed by this watch as it has great look, it has amazing appearance. Battery back up is good, it runs for 3to 4 days once charged. Tracker n sensors operates smoothly. Overall this watch is worth it."
Sarika ,5.0 out of 5 stars,Amazing product,Just love the product....buy it without any doubt 🙌
Rajat kumar sahoo,3.0 out of 5 stars,Display is not good,Display qualilty is okay but other functions are best
KS Pixe LS,4.0 out of 5 stars,Great smart wearable at this price point!!,"Great looking piece for a smart wearable at this price point! And let’s take nothing away from it, the product delivers to expectations and is practical to the core. So to sum it up -What’s great -1. Display is pretty2. Long lasting battery3. It’s waterproof and dust proof (a must have)4. Light weight and ergonomic design5. Setup is a breeze6. Activity tracking, heart rate (continuous monitoring) and sleep statistics with added health and wellness feature is a boon7. Capacitive touch panel is slickNot so great -1. Limited watch faces2. Build quality can improve3. Lacks camera remote module (basic fitness band version has it though)4. Interface can improve to make it more intuitiveOverall a satisfactory product to own and worth recommending. Hope some of the highlighted creases get smoothened out with due course."
Harsh Vardhan Khanna,2.0 out of 5 stars,Device is good but the app will frustrate you.,There are no major issues with the watch but a big issue with the app. The fitness tracker unbinds itself everyday from the app and it is almost impossible to pair it again without uninstalling the app. Colofit Pro 2 is a total waste of money because tracking down everything on the device sounds good but synchronising it is a tough job. So I wouldn't recommend anyone to buy this. I read all the reviews on amazon and bought it and was totally diappointed.
Dhruvi Sangani,1.0 out of 5 stars,Quality,The product is not of adequate quality. Alerts and notifications dont come up
Mukul,2.0 out of 5 stars,0 out of 10. I've wasted my money on looks only,Worst watch ever. Keep disconnecting from the phone . And the 2nd day stop connecting.. im getting calls elert. But no msgs elert.. I've restart my phone amd watch even their application.. still nit getting alert of msgs
Harish Wadhwani,1.0 out of 5 stars,"Despite return window open , Not accepting return! Pathetic pedometer","Bad Pedometer# Wrong steps counterBad Heart rate sensor# Delay in sensing beatsBad UI# Touch not effectiveBad Face # No joy , BoringGood body shape and sizePathetic watchReturned"
Subhash Choudhari,4.0 out of 5 stars,Value for Money | Best Smart Watch at this Price,"Pros:1. Light weight and feel very lite in hand2. Battery life is long and good3. Brightness HD display4. Waterproof5. Various sports mode like running, cycling etc.6. SpO2 measure essential nowadays7. Heart Beats Monitoring8. Steps Count accuracy9. Call Reject Replies Option10. Water and Other reminders11. Music control12. Customised Watch faces and too many options13. UI is very good and smooth14. Sleep tracking15. App Notifications like FB, what's app etcCons: 1. Connecting issue initially2. MOBILE app of Noise has some issues time to time3. After disconnecting with app it reset the data from start which i personally didn't like itOverall at this price its too good.. But it's just one week review"
Amazon Customer,5.0 out of 5 stars,Super,Amazing product i love it
Hitu Thakar,5.0 out of 5 stars,Awesome,Noise colorfit pro 2 is a great advanced version of colorfit pro... Great work of all function.. Best part of its lookout... Best value for 💰.
sachin kumar,1.0 out of 5 stars,Worst Product,It's sensors aren't working properly. You will keep moving you arm but it will not wake up. Think before you buy this. Other brands smart watches are much better than this in the same price range. I regret my decision.
Siddharth,4.0 out of 5 stars,Good buy at offered price,"I have been using it for around past 20 days and here's my review.Aesthetic: It's best, almost look alike my series 2 apple watch.Accuracy: Heart rate sensor is decent. Although not 100% accurate, I would say 75-80% accurate. Step counter accuracy: 80%Response time: (when you face your wrist to see time): There's significant lag of 1-2 seconds which you wouldn't find in apple watch or any other high end watch like fit bit or samsung gearTouch sensitivity: It's not as smooth as I was expecting but at this price range it's decent.Colors: Colors are quite good in fact much better than amazfit bip lite or Lenovo smart watch.Battery: Pretty powerful so far. Almost last for 10 days after full charge even when app notifications are always on and also heart rate sensor is continuesly on.Note: You can't take call or reply for your whatsapp messages."
chandramohan,1.0 out of 5 stars,Worst responce,"Sir I bought my new noise colour pro 2 on 15/6 through Amazon from Appario retail private Ltd by invoice no IN-DEL2-310556 for rs 3499 .As per the instructions I downloaded the noisefit sports from play store and connected with my Samsung s20 it worked well .Afternoon while charging the Bluetooth connection when off ,I tried several times to connect through the app when I select to connect it shows refresh I tried several times. I need your help to solve the problemThanks & RegardsChandramohan"
Nikitesh Vadhani,1.0 out of 5 stars,No push notifications and NO REFUND POLICY,"1. No push notifications when i use the new app. Latest firmware. Latest app. Phone - OnePlus 5 with Android 10. (works great with old app) Everytime i open the app, it shows that the device is initializing and i receive no notification on my phone with the new app even when the app is ALWAYS on in the background and battery optimization is off for this app.2. Distance does not show when i start activity from new app - shows only time.3. Tracks the distance of run VERY inaccurately when i start activity from app. Shows distance of 0.7 kms after running more than 4 kilometers.I am feeling VERY cheated. I am interacting with Whatsapp support but their solutions are not helping. I paid so much more than Mi and Honor bands only to support Indian brands but the app-phone connectivity is HORRIBLE. I am on the verge of filing a consumer-court complaint unless you provide me with a solution or else provide me with store credit and take this watch away from me."
Shubham T.,1.0 out of 5 stars,Incomplete Order,Received a different product with missing accessories
Milani Chakma,5.0 out of 5 stars,Worth buying.,"After using 3weeks my Noise Colorfit Pro 2. I would like to write my FEEDBACK in details.. BATTERY is super LONG lasting once u fully charged its goes over a week. TOUCH is SMOOTH. As for SCREEN READABILITY and the NOTIFIER _ good for reading the TIME and the NOTIFICATIONS in bright SUNLIGHT. It's delivers basic nofications: incoming calls, SMS, e-mail, social media alerts..u can add MENSURATIONS cycles alert that's helped. The reminder of IDLE Alert and SLEEPING TRACKER Helps me alots. Via this smartwatch u can control ur music without touching phone.. ACTIVITY tracking is ACCURATE. Hope this will help..if u r looking forward to buy. Its worth money."
AYUSH JAIN D,1.0 out of 5 stars,Unsatisfied,Not satisfied with the features and quality compared to Amazefit.
Balaji,4.0 out of 5 stars,A basic smart watch. Ideal for tracking exercise,"Received this today. It's pretty basic fitness band in the shape of smart watch. Installed Noisefit app on phone and connected the watch via Bluetooth.1. No call notifications , whatsapp, facebook, messages notifications received on watch.2. Watch has only 8 basic menus. 5 watch faces to choose from.3. Watches switches off screen automatically in 5 seconds with no option to change it.4. Music control does not work.5. Menstrual cycle tracking app is not present.Looks like the seller shipped another basic noise fit watch in this pro 2 box.My suggestion - Do not buy."
pranshu,2.0 out of 5 stars,"Very mediocre smartwatch, Apple Watch’s 5th copy","If you are just looking a Apple look alike smart watch then go for it, but if you are hoping for fitness band along with what a good smartwatch can do then please there are better products in market.Reviewing this after 4 weeks of use and using it for my workouts:Fitness:: I am over weight and not a workout person. Bought this so I can feel motivated once I join gym. The watch tracks your heartbeat and steps well but that’s it. It is unable to track whether you are working out or not. The calorie count only works for the steps taken. The app is never synced with the watch and won’t show data what your watch tracks.Touchscreen: The LCD screen of the watch will take you back in time when pixelated images and icons were the standard. The touch is not very responsive but does the work 70% of the time.Screen: The screen has got Bazels which is not visible in the picture.Overall a very mediocre product"
rajesh,4.0 out of 5 stars,Good watch with some minor here and there's,"Overall good watch for the price.Writing this review after 1.5 month usage.Pros:Rough and toughIp68 ratingGood displayCool watch faces.Resembles apple watch😅Cons:Limited watch faces.Accuracy in fitness tracking is low.Even after turning the auto heart rate sensor OFF, it sometimes starts measuring bpm even if you are not wearing the watch which is quite irritating and also consumes unnecessary battery at times."
