name,start,title,review
cromwell.crusier,4.0 out of 5 stars,Go for it!!,"Well, I ordered this smart watch on 1st Jan 20 and within 2 days the order was delivered at my home.Item was well packed with invoice and sealed.Looks wise gonoise color fit pro 2 is outstanding and feels premium. The watch strap is also very durable and strong yet flexible.As for the performance.. this watch performs good although there is some variations in step counts and heart monitor but it's okay with this price.You have to install Noisefit sport app to sync your smart phone with watch.Although, I'm having this issue of watch and smart phone syncing. Every time when I disconnect the watch and try to connect it with my one plus phone it doesn't get connected to it automatically. For it I've to unbind and bind the watch again with my phone.Overall, this watch performs good at this price range. So go for it and don't forget to register it on gonoise website for warranty."
REJEESH,2.0 out of 5 stars,Cons rule!,"Lots of issues to be addressed.1. Disconnection often2. Call notification doesn't disappear even when we attend the call. Keeps on vibrating. Annoying.3. Only 5 watch faces and an option to take a pic and set as the watch face. No download option or app update to get more watch faces.4. Touch panel is not so responsive. Has to tap really hard to make it sense the input.5. Had tried to contact the manufacturer ro get the issued fixed multiple times but in vain.6. Noisefit app is also below par.***Pros:1. Battery back up.2. Light weight.3.LooksBut, all these doesn't matter if it's not doing what it is supposed to..!!!"
Pratiksha,1.0 out of 5 stars,Don’t buy this product at any cost and from Amazon never!!,"Worst product ever bought. I am really very disappointed with this product, it has connectivity issue, notifications enable options is not applicable. Tried best to turn on msg or other apps notifications, but it’s not working!!!Moreover this, This time even Amazon services are proved to be worst. Connected 10 times to costumer care but no help !!Poor product!! Poor service !! and now poor me !! 😔😔"
Sagheer,2.0 out of 5 stars,Inaccurate and tough to use,"Horrible product. The app sucks and step count is beyond inaccurate. It doesn't count steps when disconnected from the app which happens more frequently than you realize. Amazfit is easy to use, go for it. India should ban noise products. All reviews on this have been misleading."
Anurag Asthana,1.0 out of 5 stars,"Not as per expectation, it is for only counting steps and your heard beats no features.",Not very good experience with this even the back is not as per the what is mentioned on Amozon.in I F this will be the kind of services then it will be not good for the Service provider as may other big Indian companies are come into the play. It will have a good dent in the business of Amazon. Even you guys are ready to take it back.
Manju,1.0 out of 5 stars,"Waste of money, don't buy.","This is just a waste of money, the response is very slow, I wanted to return the product but there is no return option and the product is faulty. It stopped connection to the device and no matter what i do it doesn't connect with the phone. Sleep tracking doesn't work."
RUPASHREE M S,3.0 out of 5 stars,Sports Mode activity selection becomes blank after pairing with iPhone XR,The media could not be loaded.  Sports Mode activity selection becomes blank after pairing with iPhone XR. Before pairing I could click on sports mode icon and select run / walk/yoga etc. After pairing with iPhone I am able to select sports mode activity ONLY from the app. On the watch if I click on the sports mode icon the screen goes blank. So I am unable to select activity walk / yoga etc from the watch.
Rahul,2.0 out of 5 stars,"Advertisement is good, product not worth it","Pairing the device is a big challenge. Within three days i installed the app 10 times.Also the notifications are not happening all times.I was not happy, but Amazon is saying we can only exchange the product. If the customer is not happy, then u should take back the product. Don't insist him to use it once again the same new one.First impression is the best impression"
Premrajsinh Jadeja,4.0 out of 5 stars,Nice Smart Watch from Noise.,"I bought this for my sister and she like this watch so much.* PROS -1. Display is nice.2. Battery Life is good.3. Somehow accurate measurements like sleeping, steps, exercisess, etc.4. Call and message reading features.* CONS -1. Mobile app need some improvement."
Amazon Customer,1.0 out of 5 stars,Pathetic,"Why you guys don't check the product functionality before dispatching it to the customer?? It creates unnecessary friction and leaves everyone in bad taste. This third rated quality no-one will accept. Will you? Would be grateful if you can refund the amount rather than replacing, we would choose from some other Company. Regards Col Goswamy"
Pomtoy Anurag ,1.0 out of 5 stars,Annoying.,"Problem with watch :1) Connectivity is worst. Even after pair, no notification, no synchronization, no alert or sms or alarm or phone call, I tured on all settings.2) Mobile application - worst.3) No easy way to take help from team.Good in watch.1) Tracking is Nice.2) Battery backup is nice.3) Touchscreen is also nice.4) Look is also premium.But over all it don't connect with smartphone.In starting it worked preet good but later it Became worst."
Sujan Choudhary,4.0 out of 5 stars,Overall it's a good product.,It's a good product on this price.Mobile app is good but i gave 4 star because of some time it's disconnected with mobile app.And than you have to connect it again from starting.Baaki aap log isse le sakte hai acche hai or koi issue nhi aaya hai abhi tak.Battery life bhi gazab hai 7 days aram se chalti hai pata bhi nahi chalta hai ki charge bhi karna hi.Main toh bhul bhi jata hu charge karna.
Pawan Kumar,5.0 out of 5 stars,A really good purchase,"I really liked the product. It does everything it advertises. It can track sleep, track number of steps, track calories and basically everything a smartwatch is supposed to do. I would really recommend it to everyone trying to buy something similar."
raghu,4.0 out of 5 stars,Looks very style and class,"The media could not be loaded.  Looks awesome, battery life very good, access soo easy, alerts and notification are too good,, using it from last 6 months,,, and only complaint i have is,, when it ask to update,, then i have to restart my mobile to recognise the device,,, rest all are superb,,, iam happy with the noise and Amazon..."
Shubhranshu Krishna,4.0 out of 5 stars,Classy watch - Under 3K 🥰,"The media could not be loaded.  If you are looking for classy watch with all major features below 3K, just go for it ❤️ No doubt , the watch is super amazing.🔸Look - super good display and wrist band.🔹Wrist sense- Works perfect. You will hardly notice delay.🔸Notifications- Tested all notification and it works fine. Watsapp, Text message, Calls, skype, outlook, gmail, telegram, viber , Facebook, Instagram, messenger 👍🏻🔹Touch sesibility- Very Good. (IPS touchscreen)🔸 Multi sports mode is good.🔹Other feature- Alaram, watch faces with customize featureJust one feature which you may find cons, but its not a big issue. Its just how you carry it.🔴IP68 waterproof- fit enough to withstand dust, dirt and sand, and are resistant to submersion up to a maximum depth of 1.5m underwater for up to thirty minutes.Not advised for beach or pool use. Water or dust damage not covered by warranty.Overall the watch is super good.😊🥰"
R. MANOJ ,3.0 out of 5 stars,Bluetooth not connecting to my mobile,I purchased this product quickly delivered working no damage app to watch connected but Bluetooth not connecting to my mobile and music changing option not working I contacted to amazon team and I speak with them and I return this product
Karthik Sahasranaman,4.0 out of 5 stars,Above average product. Bit overpriced.,"@2999/- , could have added call accepting option as well. Nonetheless, good battery life. Got it on 3rd Sep, 30% battery still available even after regular use as on 15th Sep. Nice customisable screen. Pretty much accurate Heartbeat & SpO2 tracking. Good for active kids and certain section of grown ups."
Vandan Kumbhat,2.0 out of 5 stars,"Bad at tracking pulse, overall experience is bad.","So I have used Honor Band 5 and Mi Band 3 and they are much better at being a fitness band as compared to this ( so called watch ). Doesn't track pulse properly at all, naps are not recorded. The app doesn't realise how to take smart average, if I am not wearing for 2 days of week it counts them in my avg sleep. Touch is bad too. Invest a bit more if you want a fitness watch or buy a band at this range."
Kanika,2.0 out of 5 stars,Useless item,"Firstly in among the 'many' sports modes it doesn't cover gym, aerobics, zumba etc the only thing it covers is yoga. Second n the biggest issue is that the watch keeps disconnecting from the app n u lose ur day's progress n the tech team at noise doesn't know what to do about it so yeah. Don't waste money on this"
Sach,1.0 out of 5 stars,Immature smart watch...Need to develop lot,"I bought it after looking at average ratings...however, lot of issue s with mobile apps... Not user friendly and many of the features not available. Synchronization is time consuming....Will not recommend to buy it..."
Sathish Kumar,1.0 out of 5 stars,Bluetooth connectivity issues occur often in this watch,Watch was working fine for a week and Bluetooth doesnt connected and it disconnects automatically and pairing error occurs even though u try pairing with the QR code ……. This brand should consider fixing bugs in connection with app in smartphone
Richo Vargas,1.0 out of 5 stars,Very bad watch,"The quality is good but it has a big problem, it unpairs at least once a day. So if you trying to reach an specific goal of exercise daily or weekly you won't be able to do it, because when it disconnected you loose every data of the day.So it won't track your progress. So worthless because you buy a watch to storage the progress.They don't accept a refund, they will only give you another watch. Why would I like another useless watch?"
Swapneel S.,1.0 out of 5 stars,Do not Purchased.,"The media could not be loaded.  Discount device Everytime, Bluetooth not Searching Noise Color fit Pro Device,Call notifications and Vibration on Watch appear when you pick up the phone."
itsMk,5.0 out of 5 stars,Best value for money smartwatch in the budget.,"Okay so the build is polycarbonate but it looks like metal , it's very handy and comfortable also looks stylish and yeah it has some bezels but doesn't look bad on wrist.The quality of material on this watch is good.All sensors like Blood Oxigen(SPO2), Heart Rate Monitor & Accelerometer are working fine, I've tested it's close to accurate.Raise to wake feature sometimes doesn't work at first.Overall it's a budget smartwatch and worth the price."
Ratnala Ashok Kumar,5.0 out of 5 stars,Super watch,"I got it for 2250rs, with is price range good watch. Looking nice on hand. Battery back up is ok. Accuracy of SpO2 is ok. Checked with oximeter. Shows 1-2% difference. Sports modes giving more , which r very good."
R.Rao,1.0 out of 5 stars,Save your time and money! Not worth,"The watch and app are pathetic. When I bought the watch, all the fitness stats and notifications were working fine. After a couple of days, there was no sign of notifications. Even the readings were completely wrong.Heart rate monitor is so bad that, at the beginning of my workout it showed e.g 125 bpm and after 5 mins of cardio the readings on the watch dropped to 65 bpm!!!!Absolutely inconsistent and sheer waste of money. Highly disappointed!"
Sonam Malik,1.0 out of 5 stars,watch is not working properly,"i want a replacement of the watch , it is not working properly.tried many time to connect with your customer care but i did not get any response, After all possibilities I got this option only to write here. kindly look into this.i did not get charger also , i raised issue regarding this also but no response from your side.pathetic service.will not suggest to nyone for this product."
PhaniKrishna Ch,1.0 out of 5 stars,100% waste of money,"It is just a watch, other than that nothing is functional. Bluetooth always disconnects, no app notifications, automatically app changes to DND mode. App is dead slow, very poor performance. Highly dissapointed. Realme fitness band is 10 hundered times better that this in all ways."
Vaibhav Singh Thakur,5.0 out of 5 stars,Excellent services  and product!,"Excellent product and excellent customer services. My product got hanged some days back and after online registration of complain, my watch was picked by them and repaired it at their workshop in Delhi and delivered back at my place with a 15 days . Excellent services!"
Chetan Agarwal,2.0 out of 5 stars,Not worthy,"Got this watch from Amazon.Since day 1 -Connectivity issues - watch gets disconnected anytime, and again you have to pair it.Notification issues - most of the times you don't get Notifications (even after updating the software and all)Built quality - in this price range its fine.I have registered the complaint to Noise, I am hoping they will replace the product.If they do so then 5 stars to their serviceIf they dont solve my problem then not even a single star to NOISE COMPANY itself."
TAPAS CHATTERJEE,1.0 out of 5 stars,Go for Noise Colorfit 3...,Its completely worthless..I already purchased Noise Cube..it was even better than this Pulse..No screen time adjusting..No attractive watch faces..at this cost..I prefer Noise colorfit 3 assist than t
Amazon Customer,1.0 out of 5 stars,Waste of hard earned money.,This product is firstly costing 3k with just pedometer with heart monitoring. Beside this its built & strip is of low standard. What we can get from other brand in 3000 is pedometer + heart rate + oxygen level monitoring + temp monitoring.Please invest your hard earned money with better product than this one.
Jigar soni,1.0 out of 5 stars,Bad quality product with high range (don't do mistake to buy this product),This is a very bad quality product. Battery life is very redicules and very cheap range product performance. You have to charge this product twice in a 24hr. They claim for stand by 7-10 days. But this not a truth. The application of noise is taking too much battery of the mobile..Do not purchase this product. (BETTER TO CHOOSE ANY OTHER SMART WATCH FROM ALIEXPRESS.COM).
Prashant Joshi,5.0 out of 5 stars,The Product Certainly Noise...Go for It,I received itbon 10th Oct 2021 at ₹1700Packing & Delivery superb.Pros:1.Good Display2.Good Features in given price range.3.Elegant looks4.Battery (If you want to use as normal watch without connecting to App then Battery lasts till 15 days 👍)5.You can customise the display skin.Cons:1.Proximity sensor is not that quick2.App is laggy and major bugs.3.Less Skins avialable.so Good product in the price range...Go for It
Khusbu Agrawal,1.0 out of 5 stars,Worst smartwatch wrong tracking activity,It is not a smart watch. It tracks the activity wrong. I ran 5kms but noise recorded it as 7.8km apart from that it is annoying. Don't buy that otherwise I will be wasting your money. One more thing smartwatch can't be sold at such lower price I felt that. If it is not apple or samsung it is not smartwatchVery disappoint with the product
Anil Kaka,1.0 out of 5 stars,Waste of Time and Money,"The media could not be loaded.  Noise Application is worst, due to which this smart watch is having poor value. Took 1+ hours to install noisefit app. And tracking is not to the mark. If your expectations are high, then don't go for this product as well as company. It's simply waste of time and money"
Pawan Kumar,3.0 out of 5 stars,A little disappointing,"I saw my cousin showing off his amazefit gtr on a wedding, I got jealous and ordered this, I didn't check much specifications, Just a few video ads and ordered it, Looking at those ads I was expecting it to be atleast half as good as my cousins watch, But when the watch came home, I honestly felt upset, The screen size, brightness, refresh rates are not even close to his watch. If u want a good smartwatch just spend more money.I know I was stupid to not watch the reviews and specifications, I will never do it again."
Archana M,3.0 out of 5 stars,"Harassment by Customer ""Support"" To provide feedback","The watch, when it finally connected to the finicky app, works well. I haven't used all the modes yet to give a true feedback but I'm being HARASSED nonstop by the Noise Customer Support team to provide feedback. So here it is."
Atharva,1.0 out of 5 stars,Very bad service of noise,"Very bad service of noise. I genuinely don't like the service because I have received a defective product my watch is getting restart atomatic i have to scan again and again I have contacted to Amazon customer care but my replacement date was gone so they told me to take to service centre, service centre told they can't service this watch because of some reason don't know why they told register and online complaint on noise website I have registered not a single reply has came from noise from 7-8 days .so now also my problem has not solved very service of noise"
Amit K.,4.0 out of 5 stars,Premium features at amazing price,"Amazing watch with all the features I was looking for. I purchased it in 3499..accurate pedometer, heart beat and many more features. Watch gives decent battery backup and I charge it at every 5-6 days and I must tell u that I use it 24 hours a day.If noise improve their app then this watch is really unbeatable. Their app has following drawbacks as of now and that's why I gave them 4 star instead of 5 star:-There are no watch faces which shows battery statusActivity streak doesnot work for some reasons."
SHARANBASU DIGGI,4.0 out of 5 stars,Worth the money.. beautiful design.,Smooth connection with 'mobile app'Touch screen is very sensitive and glides easily between the options.Sleep tracking haven't used much.. so can't comment.Overall a useful buy at the price.Different modes of motions like cycling etc needs little more precise accuracy.Rest all thumbs UP'
Vinodkumar,1.0 out of 5 stars,This smartwatch turns on automatically and goes away automatically.,The media could not be loaded.  The new stories were great when I picked up the watch but it turns off automatically after I take it I do not understand why it is that problem or smart watch problem I do not know if there is any solution problem for this but I will give it to itRating 2 only ..Do you know if there is any solution for this or not? I do not understand how to do Ten Days I did not change how much I tried to change the email I saw another phone is also the same as my phone This phone will be the same as I understand what it isNo ..
Aashiq Saleem Malik,5.0 out of 5 stars,Really awesome product,"Noise Gives you awesome features in all Watch,I'm happy with that product.Smart stylish and cool lookingFeatured-All messagesWhatsapp Gmail and many more notifications shown on watch it's totally awesome product"
Avinash Sharma,1.0 out of 5 stars,Noise do not have android app for this smartwatch.,Noise do not have android app for this smartwatch. Without app you can not scan and start it. Not getting an option for refund. Just replacement. Useless watch. They should clearly mention that there is no android app available for this device. Only iPhone users should buy it or buy a iPhone with the watch.Useless
LT,3.0 out of 5 stars,Fail in basic features.,"Although a good watch, but push notifications aren't coming spontaneously. Everytime I hv to switch them on from my app. Again i find that it's off. Despite switching on, notification doesn't appear. Initially for 1-2 days, it came, but not now. Idle alert activity alarmer is also not correct., As despite being active, it shows, that Pl take activity.Also, if Timer or Stopwatch is on, then u can't use the watch for viewing time, which is ridiculous.So kindly correct these basic features."
selva gnanakrishnan,4.0 out of 5 stars,Value for money,"Beast for this price range, I received this product at 6th Oct, I charged on 6th, now it's 17th Oct with 40% charge remaining, sleep tracking is not you shld expect from this watch my only issue is touch to wak would be a best, raise to wake not perfectly works all the time, overall value for money, you can't expect everything in this price range right, so for this price range it is the beast, I bought at 1,700. Don't spend more than this, wait for the offer then buy"
Amar,2.0 out of 5 stars,"Watch is OK, but the app is Worst","Watch is just OK, but the user interface and the app is very worst. Many simple actions missing or does not work well. Watch faces are only few and not really customizable. Tracking is good, but not able to analyze well with app."
Rajendra,1.0 out of 5 stars,Bad product,"This is just a digital watch not more than, wrong heart rate it showing my heart rate 110 in normal conditions,It continue disconnected with phone,No alarm it's only vibrated,No proper notification come of my phone,You can not control volumes of music,It's price not more than 1000/-"
SUDHAN,1.0 out of 5 stars,Waste,Money waste two apps are given to control watch both are not perfect waste of money instead by one plus band
Bhushan,3.0 out of 5 stars,It's good but can't expect much from it!,Screen felt old for a guy who has used all kinds of smartphones with their progressive features.Water resistance should be matched with that of Boat.Mobile app doesn't record activity sessions from the watch.Sleep tracker shows data even for the day when it was switched off.Can't be used for wearable app development.Build quality is good.Screen brightness could be better.Battery backup is good.Best for gifting it to a college student.
Kikomeko Tonny Galabuzi,1.0 out of 5 stars,Very poor. Waste of Money . Don't buy,"It's a completely different watch.When u connect, t shows T55 instead of the noise Colorfit pro 2.It's button is at the the top. .what I ordered the button is in the middle. Very poor quality . I'm returning it."
Amazon user,4.0 out of 5 stars,Only Indian product in the flood of Chinese product with great performance and decent price,"Guys, recently purchased this watch and pretty satisfied with its performance. The watch comes with 5 watch faces and on full charge the battery lasts for 7-8 days which pretty good. The step tracking may not be totally accurate but its not the show stopper. You can also check notifications from Whatsapp, Instagram, Facebook or SMS's. It also provides Idle alert, sleep tracking, Music control, Phone finder, Auto heart rate monitor.Touch screen is also very responsive.If you are looking for smartwatch go for it guys, Noise is the only Indian company which provides one of the best smart watches at these prices. Don't go for chinese companies like Mi, RealMe or Honor, go India.This is the time to support Indian companies."
Ayesha,2.0 out of 5 stars,Worst,Very disappointed with the product1. Watch Face- it takes 2 min time to change the watch face from the app (very slow)2. No continues hear rate monitoring - every time we need to go to the menu then check3.SPO2- it takes 3 min for result some time shows wear watch tightly and try again like this4 Notifications - after picking call continuously vibration 📳5 Notifications - if we get any other language WhatsApp messages it shows ¿¿¿¿¿¿¿¿ Like this6. Menu - Like Nokia 1600One of the worst product from Noise
MJ,1.0 out of 5 stars,Inaccuruate,"I have monitored this watch for >24hrs, data was inaccurate, while sleeping it shows I took 840 steps. While operating Laptop for 1&1/2 hours it shows I took 81 steps. Sleep time was accurate."
Bindya,1.0 out of 5 stars,Disappointed completely,This thing stopped working within 1 month. I've already sent an email to Noise team for it. Waiting for them to either call back or respond to the mail. Kept for charging still it's not working. It was just lying down on the table. N suddenly heated up and stopped working. I've wasted my money.. NOT WORTH!!!
Amazon Customer,5.0 out of 5 stars,Lovin' it,I am a 12 years old guy. This watch is next level. I got this as my diwali gift and I would say that this is the best diwali gift I have ever received.Pros- Touch screen is super smooth. Looks premium. Watch faces are awesome. Gives accurate measurements.Cons- Didn't find any.Conclusion- Highly recommended.
Lohith,1.0 out of 5 stars,Services not good for the product 30 days this kind of its only four to five days for returning,Worst customer service and customer care does not contact by calls we should type of all the details in that from what does not take the complete itself fastest service ever seen before going see the product it has been manufactured in China and tell that it's made in India manufacturer in India
Seshabhushan ,1.0 out of 5 stars,WASTE OF MONEY ..POOR QUALITY.. SYNC ISSUE..,Waste of Money and time.I have purchased Noise colorfit pro 2 with lot of expectation but from day 1 was facing issue. Even though I got replacement the new device is having same issue.Syncing issue with this Noise fit app.Display issue.Poor qualityAnd it's not 100% Indian
Ankit,4.0 out of 5 stars,Good in the price range,"I was so hyped by the overview, it's a nice smartwatch. Works extremely well.The band color is such a dissatisfaction. I bought grey, and just in 1 day it looks so dull and I am sure it will turn yellow in no time. That's why I want to exchange it with another color or return this item but Noise is not providing the best regards."
