name,start,title,review
Anu Amirtharaj,2.0 out of 5 stars,"It's a Budget watch but very limited options,, so think","ouch screen, sleep tracking is good.The watch is attractive sauve and with good display.color options of the watch is very appealing.Basic options like alarm, sleep tracking, saturation, pulse, step count is availble. But some upgrade know below points would be appreciable.It's a Budget watch and so with limited options which are acceprable. But please understand the watch doesn't have the option to attend the call or view the messages. I believe this can't be compromised. Back swipe and forward action is a hassle. The update face option is good but disabling and enabling is tedious job. I accidentally disabled option for choosing other photo and now unable to choose or have various option for changing the screen display.. Not very user friendly. I would definitely recommend to read the review before ordering this model. I would have prefer going for a upgraded version had I known of the limited option. So to sum up,, if you wanna gift someone but give them limited privileges -- this is the watch."
Piyush Batra,1.0 out of 5 stars,Not worth it...,"It looks like you are wearing a cheap quality product and also not worth spending 3500 on this smartwatch. U won't get anything which is actually a useful , this is only like a baby doll digital watch with 2nd standard children's wear. I'm using Amazfit and it has a far better quality of outer and display. Dial size is 1.3"" and inter screen is not even the size of 1"". U can imagine the real experience could be. My suggestion is NO."
venkat,3.0 out of 5 stars,Beginner's smartwatch,"My first smartwatch experience and after two days of usage,Blood Oxygen level: it measures only on click. It wasn't tracking oxy level automatically. However it is helpful.Sleep monitor: either sleep start time or wake up time was not accurate. Other data are interestingStep/distance count: it adding step count to account even I'm sitting in a place. Don't know how it works.Heart beat rate: We know based on activity how our heart beat will be, it shows those heart beat rate in number (BPM). In auto mode it measuring periodically to keep in record. Atleast blood pressure data helps to track health but I don't have idea about the use of heart beat rate data.Sports modes: tracking all above parameters for all modes. Sport mode Exit option is not clear.Thanks for the price, no regret.Product accuracy is not sure and it's is just a tracking device so let's not take it serious. Generally we should have healthy lifestyle."
Abinash,1.0 out of 5 stars,This is pathetic X 1000 product!!,Nothing is working in this product!App is not able to sign up using OTP. OTP itself not came!!Updating is taking 30 minutes and after updating the watch immediately you can update once again and once again and once again 😂 always there will be an update available!!Useless watch face available and you can't transfer them to the watch!!I Put it for charge for 15 minutes 1% reduced 🤔Oxygen and pulse is not working at all!!How the hell they mention it's No 1 brand in smart watch!!
Sumedha,4.0 out of 5 stars,I personally love this Smartwatch.,"This is a budget smartwatch.It has good features for this price range.After pairing this with the Noise Fit app, I get all the notifications and updates.Sleep monitoring is interesting.I personally love this smartwatch!Good going NOISE!"
Munwar Shariff,1.0 out of 5 stars,Android App is horrible,I have android phone and installed the App from Google play store. There is no screen (watch face) which matches the image which is shown for this product. Also there are no good options for watch faces. The App runs all the time (taking up my phone resources). Tried reaching out to Manufacturer. Amazon is kind enough to provide me the REFUND. Thanks to Amazon for supporting the loyal customers.
Customer,4.0 out of 5 stars,Good Product,"I have been using this for more than 2 months and my observation is that the sleep tracking is not working properly coz i get the same time record everyday..other trackers are doing good...walking, sport mode, heart rate, blood oxygen..About the mobile app...it gets disconneted oftn and its being a big job to get that connected everytime.....Over all good one...Can buy it..."
amrapali,1.0 out of 5 stars,Worst watch,Worst of the worst product ...just fooled by Amazon and noise company ...lost 3.5k bucks ....not even returning the products and there is no response from customer care also ....cursing myself for choosing such an worst company and such an worst app to buy the smart watch
Krishna kandregula,3.0 out of 5 stars,It Could Be The Best...,"A Mixed Reaction!!Watch quality is good and it exactly replicates the Apple Watch series 4 and the design is awesome also it is packed with lots of features and the display is superb (like AMOLED) but the software needs to be updated, the lift to wake up option sucks. The watch doesn't count our steps sometimes and it over count some time s but these all are of software issue and if it is fixed then it is a true ""beast "" in its segment . Overall for now it's been 3months and I'm satisfied with the features at this price."
Tanu Singhal,1.0 out of 5 stars,iOS app is missing from App Store,I received my ColorFit Pro 2 smart watch today and it can’t be connected with iOS. What the heck!App is missing from app store. Only android app is available. Without app it’s just a toy without sync. Even time displayed is incorrect.I called customer care of Noise and they informed that there is some technical glitch in iOS app and might take 24-48 hours.Are we living in a Stone Age where resolving technical glitch takes ages.Highly disappointed. Might return it back.Amazon delivery was superb. My trusted shopping portal
Tanveer Singh,1.0 out of 5 stars,Terrible product,"I had a harrowing experience with this product. Its terrible in every way. I also bought a Colourfit2 wrist band and the experience was just as bad. The wrist watch does not support cycling, it just does not register the miles. Their Customer Service is also bad it asks for so many details to just log a complaint. Buy this product only if you have time and money to waste not spare."
parameswaran,2.0 out of 5 stars,So So watch,"Stopped working the first day itself.Got it replaced by Amazon,thumps up for the quick action.Overall the quality is ok for 1900 Rs.Its unable to go back to the main menu by swiping simply when you open step tracker etc.display not so good.Bought it for use as a fitness band ,but better to by a band only ,if that's your need.If planning to buy a smartwatch go for higher models."
kalyani,1.0 out of 5 stars,Fake watch,"Pathetic experience, trust me don’t ever waste your money on this waste product, such a useless, they don’t have proper app for iOS & watch doesn’t sync to the app, crashes every time I set alarm, der is no option to set reminders, doesn’t notify messages.I truly don’t understand how come this product so good ratings.I made a mistake buying dis watch on basis of Amazon rating. Fake watch"
RAVI ,1.0 out of 5 stars,Now Very Bad product Not buy this and worst money,I bought this band seeing the features..now i regret why i have purchased..i want to shift back to MI fit which is the best band in affordable price and it worth it..i have attached pics..pls take a look.. before midnight 12 it is showing as goal completed 10k steps..after 12 it is showing that my step count is ZERO..app never syncs the data..we have to manually sync the data else it won't detect..even detected with errors..if you are seriously a fitness freak or if you want to loose weight by making 10k steps daily..PLEASE STAY AWAY FROM THIS PRODUCT..DON'T BUY THIS AND REGRET LIKE ME..WORST PRODUCT..IT IS TRUE THAT ALL GLITTER ARE NOT GOLD..I HAVE CONTACTED THEIR SUPPORT..ESCALATING THE ISSUE..NO PROPER RESPONSE..NO UPDATES TO THE APP..FEMALE MENSTRUAL CYCLE DATA IS WORST PART..I CALCULATE FAR BETTER THAN THE APP
Ruchi,3.0 out of 5 stars,"Okish watch. Very limited features, colour is good","The media could not be loaded.  The colour and appearance is good, features are very limited because of which I was thinking of returning the watch and look for another one. It was mentioned at the time of purchase that I can return this product in 7 days but when I tried to return and asked for refund it was refused and said that only replacement is available you can only replace and get the exact same watch in return."
Arus Chandran,5.0 out of 5 stars,Only for Mobile Notifications & Time,"The watch is beautiful and well sized for small wrist. Medical trackers are useless and I purchased this just for mobile alerts while I drive and on meetings. So, the Heart Rate sensors and other sensors if any, is always off which gives me a battery backup of 15 days. No complaints, touch is not smooth but can ignore. For this price, it is a good notification device."
Mangal singh,1.0 out of 5 stars,This product is just a toy for kids so don't buy this product for tracking the physical activity.,"This product look like a toy which is given by parents to their kids. This product doesn't give any single information in accurate manner like Physical activity distance measurements, heart rate monitoring, steps count and other activities which for they have made this product. Even my some other mobile app is showing some accurate results like step count, distance measurements calories burnt etc.This watch is measuring heart rate , step count, even after removing the watch from wrist for 4, 5 hr. Bluetooth connectivity is very very low even if mobile (This products app) app is running but distance is around 1 to 2 meter then it's disconnect from phone.1. Sleep tracking is very very low.2. Accuracy- Don't say anything about accuracy . It's doesn't give even a single activity in accurate manner. It's disappointed me😭😭 (I bought this product only for tacking the physical activity but it's disappointed me)3, Touch screen is not that much good what they have give in specifications.So overall I will give rating for this product in between 0 to 1. Not more then 1 out of 5.So I recommend you to don't by this product. It's useless. Waste of money.( This review is based on 5 days uses from delevery date)"
Dilower H.,5.0 out of 5 stars,Excellent product,"Best start watch in this price range so after usage of 20days here are few things you need to know.1.Accurate calculations of Sleep tracking,BPM,Steps etc2.Water resistant3.Size is perfect ,battery from 100% to 5% in 9days4.Notifications from phone is visible but you need to download Noisefit sport and enable notifications as per your choice - incoming call ,what's app,telegram ,messages etc5.Screen protector - buy it from Amazon ""FCS ultrathin 0.125 mm anti shock flexible smart watch screen protector for noise colourfit pro 2 "" works amazing"
Amazon Customer,4.0 out of 5 stars,Good watch but it counts steps even when u r traveling,"Watch is good , but app is the issue , it didn't synch with Google fit app . It's own app doesn't work properly . Only watch is good. But it'll count steps even when m traveling somewhere so I have to switch off it when I am traveling and then again on it back when I am walking . So I'll give 3.5 stars . Touch is good . I can control music as well ,which is good"
Sanket R Patel,5.0 out of 5 stars,Perfect watch,This watch is good in this price range.
Bhavya vyas,2.0 out of 5 stars,Not Recommended buy.,.I bought this for someone else who did not like it. Average. Light display is disturbing specially at night while sleeping it ligts up and destroys sleep .Steps tracking is average. I found mi band better at tracking and giving me a preview.The display seems good however swiping movements are not user friendly.A little disappointed as mi band was better than noise fit. Have been using this watch for 6 months now. Ready to trade it in
Vaseem Baig,2.0 out of 5 stars,"If you want for looks, Sure go for it.","Sync with noisefit app is totally blunder. Watch show some stats and app shows another. If a whole day you don't connect with phone, the app skip that day's data.Touch works sometime slow. Only look wise good product."
Sarah,5.0 out of 5 stars,Good one,"It was a gift for my husband and he loved it. He wears it everyday without fail. The only problem is the mobile app which has connectivity issues. Apart from that, it's worth it.The customizable watchface is something I love personally."
Amazon Customer,1.0 out of 5 stars,My one of the Worst purchase from Flipkart.,My one of the Worst purchase from Flipkart even after complete notification problem is nowhere tobe solve. How can i used smartwatch if i can't even connect that properly with Realme 3 Pro and bluetooth connectivity is even worth than that. Whenever i try to connect with my Realme 3 Pro it's say error item 144 device can't pair what the hell meaning of that. All this problem i face are after replacing previous product. So i strongly suggest that doesn't ever think about purchasing this smartwatch device.
kirankumar,5.0 out of 5 stars,Good,"After using for 20 days, i am here to write a review. This product is well packed and user manual is good. You cant connect with your smartphone directly with bluetooth. You need to download noisefit app for that and need to connect your watch. Connectivity is good. Fraction of seconds delay on notification. Display is good, feel is good. Looks is very good. SNS, like whats app, msg, facebook and other app notification you can see only. You can see the first line of each notification, but cant enter into the msg. To read the msg you need to use your phone(unless the msg is one liner).Heart rate monitor is closely correct. Step count is good. Sports mode is great. Real count of a cumulative of 3 steps. Alarm works well. Truly water proof(follow the IP68 standard). Dont use in salt water, it can damage.My usage is very high and still i get 4 days battery back up. Its pretty good."
nirav patel,2.0 out of 5 stars,Its a hyped fitness tracker. .... please dont call it a smart watch,"The features of this watch are minimal. You cannot track workouts or activities other than basic walking cycling and running. Since this does not have an inbuilt GPS I thought I would use the noise fit app to track the location while cycling. The app does not provide any such tracking. i tried searching for the same but could not find anything online. There are different versions of the app. noise fit noise fit sport ..both didnt have any gps things or atleast i could not find one after hours of tinkering with the app and searching their official website.The worst part is that there is no sync between the app and the watch. If you start an activity on phone with your watch connected., it is not tracked.If you are planning to buy fitness tracker, its better to go for mi bands.. they are cheap and give good functionality. This just has a fancy display but rest its just a fitness tracker. Callign is smart watch is wrong"
abhi,1.0 out of 5 stars,DONT BUY IT,"when an activity is tracking it is resetting itself randomly, and my step goal is also changing as its wish, you can t depend on itThe sleep tracking is a big waste I guessdevice and phn are not synced if I unpair and pair for some hanging reason it automatically rests everything and the phone shows one count and the device shows zero.DONT BUY IT DONT BUY IT DONT BUY IT DONT BUY IT DONT BUY IT DONT BUY IT DONT BUY ITDONT BUY IT DONT BUY IT DONT BUY IT DONT BUY IT DONT BUY IT DONT BUY IT DONT BUY IT DONT BUY IT"
Debanik,2.0 out of 5 stars,No Call Notification,"I bought this watch for call notification, rest features were just bonus for me, and on this watch call notification doesn't work!! Tried multiple smartphones, every setting tweaks, kept the noise app locked in RAM, nothing worked. For the rest of the features, i have no idea , oh one more thing, the UI adverrised is not the same on the watch! Returned this watch coz of false advertising (No Call Notification). Amazon is awesome for quick help!"
Amit kabadi,5.0 out of 5 stars,noise Colour fit pro 2. Go for it guys. Awesome product,"If u consider pricing , it is not possible to get any branded smartwatch in that price range. There are similar smartwatches are available on net with more features but nobody assures you warranty and one cannot say features which they promise will actually work once u receive the product. Gone through detailing of this product, and yes I feel one of the best product in the market."
rajeev singh,2.0 out of 5 stars,Pathetic Bluetooth pairing.,The media could not be loaded.  Every thing is ok exept Bluetooth connection. Watch is disconnected each and every time.And it does not connect automatically have to search through app every time which is very irritating.
Santhosh.G Acharya,1.0 out of 5 stars,Waste of money on this worthless device in my perspective..,To hell with this. Only its curve edge looks are the main attraction. Other than that its tottaly a pack of nonsence for an excess price. This does not satisfy any needs of any gentlemen in its features. Its a famine favourable device with a big display... Totall waste of my money on this battery crap device..
God of undead,3.0 out of 5 stars,Need more improvement,added/edited comments - received the replacement watch and it's battery is much better now. Still Mi Band has much better functionalities and better UI APP. Sleep tracking is poor and the afternoon nap is not considered separately (it counts with the night sleep). Notification alerts not working properly. Need serious attention with the app. It will be good to show weather updates in the watch. Find my phone option make the phone vibrate but no sound. Other smart watches with lower cost have better functionalities.
Aakash Desai,1.0 out of 5 stars,A worst product I have ever bought in my life!,"Not recommended to buy. A total waste of money. Apps are not developed upto the mark. Only replacement policy and no return policy on this product. Sleep tracking is not working, accuracy is at lowest, settings got automatically changed, auto sync is not available, connectivity with App is terrible, notifications of only few apps can be seen on watch, no manual app addition for notification can be done. If noise will refund then I would straight away like to return this product!Just 1 star for straps otherwise nothing to be rated!"
Madhuri,5.0 out of 5 stars,Good,"It has all the features like sports mode, sleep tracking, music control etc, the build I feel is very similar to Apple Watch, nice price point, has sleep tracking and menstrual tracking too. Has different watch faces, instead of spending 35k-55k for an Apple Watch you can get a dupe like the noise one for a very lesser price and still can almost enjoy all the features."
Anand,3.0 out of 5 stars,"It's a budget smartwatch but upon comparison with Amazfit, the latter is a sure winner.","This is the third smartwatch I purchased in the family (first two were Amazfit BioU and BIPU pro). Upon comparison, this one is lagging behind due to these reasons:- Sleep tracking lacks REM- sleep tracking time shows inaccuracy- no GPS- not fully waterproof (can't take it to the pool)PROS- Slightly bigger screen- Was slightly cheaper when I purchasedI would surely vote for Amazfit in this price range"
Lakshmi K Iyer,5.0 out of 5 stars,ITS A MUST HAVE!!!!!!!!!!,"I always wanted to have a fitbit. This is really awesome with very good touch screen and has various facilities covered under one lense. It can detect your walking, running, jogging speed, keep a tracke of your heart rate, it has built in phone finder so it will help you find your phone if you pair the phone with fitbit using bluetooth. You can also set alarm like in mobile. It's very very useful. You also can set for call, messages, watsapp, fb and many more alerts. It also has a seperate tab for female health and periods tracker which keeps track of your periods and keeps you updated. This tiny mint device has 100 times more than what I had expected and hence it's worth the money.Charging the device is very easy.Battery life is for 7 days even if you use it every day.You can customise the watch face as per your convenience.It's a superb gadget."
Aniket,5.0 out of 5 stars,Classy Stylish Value for Money Good Product,"Writing this review after 15 days of Usage.1. Battery still remaining 12% after 13 days2. Add any number of watch faces you want to.3. Gets Paired very easily ( Im using Google Pixel 2XL)4. Display screen is good and looks are very decent just like a VW i.e Classy.People here have mentioned the above points repeatedly about these issue I have faced none of it. Before buying I have seen option like Skagen , Fossil , Titan and many more around the range of 12k coz the other like garmin and Samsungs and apple was way too costly.If you want a nice decent classy smart watch just go for it you will not repent . After seeing my watch in my office 2 of them have already purchased it."
ajay m v,4.0 out of 5 stars,2 Weeks Usage Review,"Good watch for health and fitness as of for cost range we expect more quality, as per 2weeks usage nice watch, it shows Bluetooth music connected but does not shows which song is playing, shows who is calling but unable to receive their call but only able to decline or quick replay, pedometer is bit good and accurate, sleeping tracker not as much accurate, battery life is good 9-10days, but the sad thing is there is no good collection of watch faces, only on the festival offer 1.7k is a good deal for the watch as per features & built quality."
Bajoriavinayak ,1.0 out of 5 stars,Worst Watch ever,"Even for a Chinese product, this is garbage. The calorie burn tracker will give you different readings by a difference of 1000 for the same rate of an outdoor workout. There is no indoor workout support like boxing, cardio. The app will never be able to sync with the watch. So basically it's useless after 1 day. I should have gone with the Apple watch. Chinese maybe able to colonise Africa with their debt trap but I have learned lesson for life."
KULBHUSHAN,1.0 out of 5 stars,Very bad experience! Waste of money.,"I ordered this watch. It was not reliable as it got reset on its own within one week and all previous data got lost .On replacement with the new one, the second one worked fine for 1 week. On 8th day itself, that too stopped working completely and now it's dead. Have put it up for replacement under warranty which will take time. My sister also purchased the same watch which worked fine for 3 weeks, then pairing issues occurred and the application is still not working properly even after reinstalling it multiple times. Highly disappointed."
yogesh pant,1.0 out of 5 stars,WROST PRODUCT,"If you reading / looking at the positive reviews and buy it, well you have got the worst product of your lifetime. Don't waste your hard earned money on this crap product, i must say just stay away, buy Hawaii, MI, SAMSUNG BANDS INSTEAD....This watch have Bluetooth connectivity issues and disconnects automatically even if your phone in your pocket.....STAY AWAY FROM THIS PRODUCT....."
Rajesh,5.0 out of 5 stars,Don’t hesitate; Worthy product with cheap cost.,"Compare to costlier smart watches like apple and Samsung its better at ₹3,000.Don’t expect too much. But it satisfy pretty much. If this one is your first smart watch means definitely make you cool at low cost."
Aashik Saji,2.0 out of 5 stars,Defect product,"I got the watch,but there was a line appearing in the display right through the middle so was a detective product i have got. And i chose to replace the product the same day i got it,because i like the watch for it's pretty good design and style,but there was no replacement option and obviously i could only go for refund option. And again i ordered the same product and expect the delivery in a couple days. Kindly make sure that i get good quality product this time with zero defects ."
Amazon Customer,1.0 out of 5 stars,Do not buy. Not up to mark. Not worth the discounted price.,The watch doesn't not have an always on display option and the wrist sensor works very late and is very frustrating.The watch only connects with the companies app and does not have enough features for the price range.The touch screen is non responsive. Poor user interface.The location reporting is inaccurate. It calculated 10km for when I only ran 8km and calculates distance when you're sitting in a car.
Shubham Basu (Bose),1.0 out of 5 stars,Mediocre and disappointing..,Got this for my kid. Battery drains in a few hours. Last night after full charge it showed 7pc in 10 mins. App has a customer care number that doesnt work. It buttons for lodging compliant r useless.Pathetic...20 days later- After raising with the executive team the watch was replaced. The new one is working fine...so far..
Vinod Kaul,1.0 out of 5 stars,Poor product which cannot be returned,The step numbers are very small. We are senior citizens and can only read it with a magnifying glass. The connection with mobile doesn't always work smoothly. The hand flip to light the face doesn't always work. Amazon refused to take it back and only offered replacement which is no good for us.
Deepti Gogia,1.0 out of 5 stars,Absolute waste of money and time,"Terrible experience! The watch doesn't stay connected at all the timesOne gets no notificationsEverytime you have to login to the app, to connect and there also it takes over 3-5 mins to connectThe watch is right next to the phone, and the mesagae displayed is that device not in range,Pls don't but an waste your time and moneyAmazon was kind and extremely helpful in arranging a super quick replacements(less than 24hrs) but the replacement watch was equally terrible"
